name,course,diet,ingredients
japanese curry arancini with barley salsa,Japanese,vegetarian,"japanese curry, sticky rice, cheese inside rice, barley salsa, wasabi mayo, red capsicum cube (cut), yellow capsicum cube (cut), green capsicum cube (cut), green chili, barley, butter, white pepper, light soya, salt"
japanese fish stew,Japanese,nonvegetarian,"sole fillet (you can also do 2/3 types of fish), large shrimps (optional), potatoes (peeled), onions (cut into slices), garlic cloves, red capsicum (can use green also), parsley or coriander (choose the herb that most suits your taste buds), few dashes of hot sauce, paprika, olive oil, white wine, rock salt"
jerk chicken,Indian,nonvegetarian,"chicken legs, lime (halved), jerk seasoning powder (bottled), jerk seasoning paste (bottled), olive oil"
kale channe ki biryani,Indian,vegetarian,"black gram (kala chana), basmati rice (soaked for 2 hours), cinnamon, green cardamoms, cloves, ghee, black cardamoms, black peppercorns, bay leaves, onions, green chillies (slit), ginger-garlic paste, coriander powder, turmeric powder, yogurt, fresh mint leaves, fresh coriander leaves, garam masala powder, red chilli powder, salt, cashew nuts, almonds, milk, fresh cream, saffron, ginger, screw pine essence (kewra), browned onions, whole wheat flour dough"
kasha bread,French,vegetarian,"kasha, boiling water, buckwheat flour, all-purpose gluten free flour, brown sugar, baking powder, baking soda, xanthum gum, salt, buttermilk, cream, egg, oil, walnuts"
kerala fish curry,Indian,nonvegetarian,"white fish (cut into cubes), onion, tomato, garlic cloves, fresh green chillies (deseeded), oil, fresh coconut paste, red chilli paste, coriander powder, turmeric powder, salt, whole dry red chillies, black mustard seeds, curry leaves, tamarind extract, water"
khichdi,Indian,vegetarian,"Quick cooking oats, peanuts, cumin, turmeric powder, red chilli powder, onion, tomatoes, carrots, green peas, ginger, green chillies, salt, extra virgin olive oil, water, coriander leaves"
koldil chicken,Chinese,nonvegetarian,made with banana flower; an assamese specialty
kolim / jawla,Indian,vegetarian,dried fish named kolim or jawla found in coastal maharashtra with onion and spices. usually eaten with bhakri or chapati
kuttu atta pizza,Italian,vegetarian,"kuttu atta, salt, sugar, yeast, mozzarella cheese fresh, tomato, basil, cottage cheese, green chillies, olive oil, salt, black pepper (crushed), oregano"
lamb and chargrilled bell pepper soup,Healthy Food,nonvegetarian,"lamb bones (preferably shank and shoulder), onions, celery, ginger, garlic, carrot, chargrilled red/yellow/green bell peppers (quartered), whole spices mix (black pepper, cinnamon, cardamom, clove, bay leaf), salt, water (warm), oil (sunflower or olive"
lamb barley pot,Healthy Food,nonvegetarian,"pot barley, onions, worcestershire sauce, chilli flakes, mustard seeds, thick mutton chunks, thick neck of lamb chops, water or stock (to cover), salt, black pepper (freshly ground)"
lamb korma,Indian,nonvegetarian,"onions, almond paste, ghee, cinnamon sticks, green cardamom, cloves, mace, bay leaves, garlic paste, ginger paste, lamb, salt, rose water (infused with 4-5 strands of saffron), yellow chilli powder, yogurt, yellow chilli powder, black pepper powder, coriander seed powder, cumin powder, red chilli powder, turmeric powder, clove powder, green cardamom powder, rose petal powder, nutmeg powder, black cardamom powder, fennel powder, cinnamon powder, mace powder, onions, cream/malai"
lamb rogan josh,French,nonvegetarian,"lamb chops or stewing lamb, vegetable oil, cassia bark or cinnamon stick, bay leaves, green cardamoms, onions, garlic cloves, butter, turmeric, chilli powder, ground cumin, ground coriander, tomato puree, salt, garam masala, lemon juice"
lemon honey glazed sous vide corn on the cob,Snack,nonvegetarian,"young corn on the cob, honey, lemon juice, garlic cloves (smashed), celery stalk, chives, carrot, salt, paprika powder, parsley, plastic bag, food thermometer"
lemon poppy seed cake,Dessert,vegetarian,"plain flour, baking powder, salt, castor sugar, baking soda, eggs, butter, vanilla essence, lemon juice, poppy seed, lemon peel, to serve:, lemon syrup, whip cream, fresh berry"
lemon poppy seed cake ,Dessert,vegetarian,"Flour, Baking Powder, Salt, Castor Sugar, Baking Soda, Eggs, Butter, Vanilla Essence, Lemon Juice, Poppy, Lemon Peel, Lemon Syrup, Wiped Cream, Fresh Berry"
lemon rice,Indian,vegetarian,"cooked basmati rice, oil, asafoetida (heeng), mustard seeds (sarson), curry leaves (kadhi patta), whole red chilli (sabut laal mirch), turmeric powder(haldi), salt, lemon juice, peanuts, urad dal, chana dal, ginger"
lemon sushi cake,Dessert,vegetarian,"Vanilla pre mix, gel, oil, water, egg yolks, lemon juice, sugar, butter, white chocolate, cooking cream, milk"
lotus leaf wrapped fried rice,Chinese,vegetarian,"Jasmine Rice (Baked), Edamame Beans, Mock Meat, Shitake Mushroom, Spring Onion, Dark Soy Sauce, Sunflower Oil, Salt"
malabar fish curry,Indian,nonvegetarian,"whole coriander seeds, whole red chilli, coconut oil, mustard seeds, onion, curry leaf, coconut milk, tamarind pulp, coriander, seabass fish curry cuts"
malabari fish curry,Indian,nonvegetarian,"sear fish, coconut, ginger, pureed tamarind, salt, powdered turmeric, green chillies, red chilli powder, shallots"
matcha tea macarons,Dessert,vegetarian,"egg whites, breakfast sugar, icing sugar, almond powder, matcha powder, heavy cream, white chocolate"
meat lovers pizza,Italian,nonvegetarian,"millet flour, tapioca flour, soy milk, garlic powder, baking powder, salt, tomato sauce, mozzarella cheese, prosciutto, pepperoni, chicken salami, salami milano, rosemary, olive oil"
methi chicken masala,Indian,nonvegetarian,"boneless chicken, lemon juice, red chilli powder, salt, ginger garlic paste, curd, red chilli powder, salt, coriander powder, oil, onion, oil, bay leaf, green cardamom, black cardamom, cinnamon, ginger garlic paste, tomato, kasoori methi, green chilli, water"
methi malai cranberry chicken,Indian,nonvegetarian,"Chicken (sliced ??into large pieces), salt, cranberry puree, red chilli powder, garam masala, coriander powder, cumin powder, chaat masala, corn flour, fenugreek leaves, gram flour, ginger, garlic, cream, Greek yogurt, butter"
mexican pizza,Mexican,vegetarian,"Dough tortia, refried beans, bell paper, spring onion, lettuce, mozzarella cheese, orange cheddar cheese, chitpole dressing, for pico de chelo, tomato, onion, lemon juice, salt, green chilli, coriander, black beans (boiled ), Tomato, onion, vine paper, vegetable oil"
microwave chicken steak,Healthy Food,nonvegetarian,"chicken breasts (boneless), eggs (slightly whisked), ginger paste, garlic paste, onions, coriander leaves, green chillies, black pepper powder, flour, vinegar, salt, oil"
microwave chocolate cake,Dessert,vegetarian,"Flour, castor or powdered sugar, oil, butter or margarine, cocoa powder, water, vanilla essence, baking soda, baking powder, salt, egg"
microwave tandoori chicken,Indian,nonvegetarian,"Chicken (sliced), garlic paste, ginger paste, Hung curd, salt, garam masala, coriander powder, pepper powder, cream, oil, for garnishing:, lemon pieces, onion rings"
mix fruit laccha rabri tortilla crunch,Mexican,vegetarian,"milk, sugar, cardamom powder, saffron, almonds and pistachios, grapes, apple, kiwi, orange, pomegranate, mint leaves, tortilla sheet, oil"
mixed beans salad,Healthy Food,vegetarian,"mixed boiled beans (choose from rajma, chawli, chick peas, hara chana), spring onions, tomatoes (diced), oil, lemon juice, basil, garlic, salt and pepper, for garnish:, coriander"
mixed berry & banana smoothie,Healthy Food,vegetarian,"Frozen mixed berries, ripped banana,fresh orange juice, low fat curd"
mixed salad with lotus root,Healthy Food,vegetarian,"Iceberg Lattoos, Lolo Rosso, Endive Lettuce, Red Cabbage, Lotus Root, Kaddu, Yam Beans, Small Onions, Pomegranate, Chalet Oil, Pomelo, Lemongrass Sauce"
mixed vegetable soup,Healthy Food,vegetarian,"Mix vegetable (tomatoes, carrots, peas and French beans), salt, cumin powder, oil, curry leaves"
moong dal kiwi coconut soup,Indian,vegetarian,"green gram (dhuli moong dal), kiwis, coconut cream, oil, bay leaves, cumin seeds, coriander seeds, black peppercorns, garlic cloves, medium onion, carrot, turmeric powder, curry powder, salt, fresh coriander sprigs"
mother christmas cake,Dessert,vegetarian,"tart apples (2 large), sugar, apple juice, eggs, vegetable oil, vanilla extracts, all-purpose flour, apple pie spice (cinnamon), salt, pecans, candied red cherries (halved), candied green cherried (halved), candied pineapple (diced), cashews (optional)"
mushroom matar,Indian,vegetarian,mushroom and peas in a masala/chili sauce
mustard-parmesan whole roasted cauliflower,Healthy Food,vegetarian,"cauliflowers, garlic, halved, olive oil , dijon mustard , kosher salt , freshly ground black pepper , fresh parsley leaves, parmesan , lemon wedges"
oats shallots pulao,Healthy Food,vegetarian,"Rice, Green Coriander, Green Chillies, Onion, Cinnamon, Cardamom, Cloves, Red Chilli Powder, Salt, Garlic Flakes, Ginger, Chalet, Olive Oil"
orange quinoa sevaiyan,Healthy Food,vegetarian,"sevaiyan, quinoa, orange juice , dried figs, sugar, almond milk, desi ghee, jaggery, walnuts, melon seeds, peanuts"
oyster lamb,Thai,nonvegetarian,"vegetable oil, garlic, ginger, lamb, stock, oyster sauce, dry sherry, sugar, celery, salt, bokchoy, shitake mushroom"
pan seared thigh of chicken,Mexican,nonvegetarian,"Chicken Thai, Salt, Pepper, Lemon, Fresh Thyme, Barley, Brockley, Mushroom, Extra Virgin Olive Oil, Cherry Tomato"
pasta in cheese sauce,Italian,vegetarian,"Milk, Flour, Butter, Pepper Powder, Nutmeg, Cheese, Pasta (of your choice)"
"peach, raspberry and nuts smoothie",Healthy Food,vegetarian,"fresh raspberries, ripe banana, almond, fresh peach slices, low fat yogurt, fresh raspberry, peach fruit slices, almonds"
peri peri chicken satay,Snack,nonvegetarian,"boneless skinless chicken thigh (trimmed), salt and pepper, yogurt, chilli powder, ginger garlic paste, coriander leaves, oil to fry, peri peri sauce, potato fries"
pesto fish kebabs,Indian,nonvegetarian,"King fish cut into one inch pieces, paprika cut into one inch pieces, bezel pasto, white wine vinegar, salt, cooking spray"
pista chocolate & mandarin,Dessert,vegetarian,"Pistachios, milk, sugar, broken rice, green cardamom, white chocolate, milk, egg yolks, whipped cream, vanilla pod, mandarin, sugar, water"
plum and cherry roasted chicken,Healthy Food,nonvegetarian,"carrot (finely diced), onion (finely diced), celery (finely diced), fresh thyme sprigs, whole free range chicken , pepper (freshly ground), parsley stems, celery leaves, lemon slices (1/8 inch thick), onion, carrot, fresh lemon juice, chicken stock/broth, plums (cut), fresh cherries"
plum cake,Dessert,vegetarian,"oven temp: 150 c-300 f, butter, sugar, eggs, almonds, vanilla essence, mixed fruits (sultanas, raisins, candied peels and cherries), refined flour,"
prawn and litchi salad,Healthy Food,vegetarian,"prawns (shelled and cleaned), spring onions, mango flesh, litchis (deseeded), chilli flakes, lemon (for lemon juice), olive oil, peanuts (to garnish), salt"
prawn fried rice,Thai,vegetarian,"Oil, Bacon, Prawns, Chicken, Carrots, Garlic Buds, Ginger, Spring Onion, Sweet Chili Sauce, Soy Sauce, Salt, Pepper, Sweet Corn, Vinegar, Baked Rice, Green Coriander"
prawn potato soup,Thai,vegetarian,"Onion, potato, prawns, eggs, milk, butter, coriander, salt, water"
puffed rice,Snack,vegetarian,"grain made from rice; usually made by heating rice kernels under high pressure in the presence of steam, though the method of manufacture varies widely. pori (puffed rice) has been mentioned in various tamil literatures as an offering to hindu deities. offerings of pori and jaggery made to vinayagar (lord ganesh) are mentioned in the tiruppugazh, a 15th-century anthology of tamil religious songs, written by tamil poet arunagirinathar. pori is offered to hindu gods and goddesses in all poojas in the south indian states of kerala and tamil nadu."
puffed rice squares,Snack,vegetarian,"puffed rice, nuts, honey, jaggery, butter, kewda to flavor, cardamom powder"
quick chicken curry,Indian,nonvegetarian,"Chicken, onion paste, tomato, garlic paste, ginger paste, coriander powder, cumin powder, turmeric powder, red chilli powder, garam masala powder, oil, salt, green coriander"
quinoa coconut crumble custard,Dessert,vegetarian,"Knoia (cooked), oats, cinnamon powder, salt, brown sugar or jaggery, nuts, coconut nuts, eggs, kinoia, coconut milk, maple syrup, vanilla extract, cinnamon powder, salt, honey"
ragi coconut ladoo (laddu),Dessert,vegetarian,"finger millet flour (ragi), jaggery, peanuts, coconut, salt"
ragi oats ladoo (laddu),Dessert,vegetarian,"ragi flour, oats flour, dates (ripe), milk, honey, ghee, green cardamom powder, white sesame seeds, coconut powder, cashew nuts"
red rice,Healthy Food,vegetarian,riety of rice.
red rice poha,Indian,vegetarian,"Onion, Pepper, Button Mushroom, Wild Mushroom, White Wine, Tomato, Sage Leaf, Red Poha, Truffle Oil, Rosemary"
red rice vermicelli kheer,Indian,vegetarian,"red rice vermicelli / broken sooji / semolina vermicelli, butter, almonds, whole milk, cardamom powder, saffron strands / thread, sugar"
red velvet banana pudding,Dessert,vegetarian,"one can of sweetened condensed milk, ice cold water, instant vanilla pudding mix, cream cheese (softened and cut into 8 pieces), heavy cream, one 9 x 13 inch layer of red velvet cakcake, ripe bananas, mini chocolate chips, sugar, cocoa, cake flour, baking soda, salt, butter (room temp cut into 1 inch pieces), eggs, milk, sour cream, cider vinegar, vanilla extract, red food coloring, all-purpose flour, milk, unsalted butter (room temperature), sugar, vanilla extract"
red wine braised mushroom flatbread,Italian,vegetarian,"olive oil, fresh buffalo mozzarella cheese, canned pelati tomatoes (cooked), pizza/flatbread base, mushrooms, red wine, parsley, garlic cloves (halved), salt"
restaurant style fried chicken,Chinese,nonvegetarian,"egg, salt, white pepper, maida, salt, red chilli powder, garlic powder, ginger powder, onion powder, oregano, chillil flakes, white pepper, basil, chicken drumsticks, salt, white pepper, bread crumbs (as required)"
rice,Indian,vegetarian,boiled rice
rice in lamb stock,Thai,nonvegetarian,"Rice, desi ghee, big cardamom, bay leaf, cinnamon stick, fennel, onion, lamb bonz, royal cumin, cashew, cream, green cardamom powder, salt, water"
rice kheer,Indian,vegetarian,"milk, rice (washed), sugar, raisins, green cardamoms, almonds (shredded)"
"risotto lobster with parmesan egg pancake, confit tomatoes and coral tuille",Italian,nonvegetarian,"lobster shell, carrot, leeks, garlic cloves, tomato paste, bay leaf, peppercorn, water, lobster meat, arborio rice, onion, leeks, lobster stock, parmesan cheese, cream, salt, olive oil, egg, parmesan, flour, milk, parsley, salt, cherry tomatoes, garlic pods, olive oil, water, oil, flour, salt"
roast turkey with cranberry sauce,Healthy Food,nonvegetarian,"whole turkey, butter, onion, celery, crumbled sage and thyme , salt and pepper, garlic minced, balsamic vinegar, sugar, cranberry"
roasted spring chicken with root veggies,Healthy Food,nonvegetarian,"whole chicken, thyme, garlic, lemon, orange, salt, black pepper, butter (to rub), extra olive oil, carrot, turnip, beetroot, chipotle powder, parsley"
saewoo bokumbop (shrimp fried rice),Japanese,vegetarian,"cooked rice, shrimp (de-veined, onion, cooked green peas, green onion, egg (scrambled), vegetable oil/butter, soy sauce, sesame oil, salt, pepper"
sali boti (parsi meat dish),Indian,nonvegetarian,"mutton (wash and cut into very small cubes), ghee or oil, tomatoes, onions, green chillies, coriander leaves, chilli powder, turmeric powder, ginger-garlic paste, water, vinegar, jaggery, salt, potatoes, oil"
seafood rock filler,French,vegetarian,"baked tart of mixed sea food served with phyllo fruit bowl, savory tart shell (semi baked), mixed sea food, mornay sauce, assorted herb and seasoning, phyllo pastry, assorted seasonal fruit"
seared salmon in tabasco butter,Thai,nonvegetarian,"butter, tabasco, chives, salt, salmon fillet, olive oil, sea salt"
shepherds salad (tamatar-kheera salaad),Healthy Food,vegetarian,"1 cucumber peeled and chopped, onion, tomato, green chillies, garlic buds, pasarley, olive oil, lemon juice, salt and pepper"
shiitake fried rice with water chestnuts,Chinese,vegetarian,"Shitake Mushrooms, Vegetable Oil, Garlic Buds, Green Chillies, Water chestnuts, Onions, Leaks, Celery, Ginger, Sesame Oil, Rice Baked, White Chillies, Salt, Rice Wine Vinegar, Green Onions, Small Bunch Pasarley, Sesame Oil"
shrimp & cilantro ceviche,French,vegetarian,"prawns, gherkin, onion, cilantro, mix bell pepper, tiger milk, sweet corn, sea salt, black pepper, green lemon juice, cherry tomato, edible flower, coriander stems, celery stalks, garlic, ginger, red onion, lemon juice, sea salt, black pepper"
slow cooked spiced sangria,Mexican,vegetarian,"red wine (merlot / zinfandel), apple cider, honey, orange (zested and juiced), cloves (whole), green cardamom, cinnamon sticks, anise (whole), brandy"
sous-vide salmon tikka,French,nonvegetarian,"norwegian salmon, black garlic pickle, butter, butchery bag, smoked yogurt, home made prawn crisp, edible flower, salt"
southern fried chicken tenders,Snack,nonvegetarian,"Chicken breast (cut 20 strips, 20 grams), all purpose flour, salt, hot red chillies, eggs, bread crumbles, white cabbage slaw, pasarley sprig, honey-mustard dip, green bell pepper"
soya milk,Beverage,vegetarian,"Soybean, hot water"
spaghetti with clams & crispy bread crumbs,Italian,vegetarian,"panko, 1/4 cup plus 1 tablespoon extra-virgin olive oil, plus more for drizzling, kosher salt, freshly ground pepper, garlic cloves, manila clams or cockles, scrubbed, dry white wine, spaghetti, lemon zest, lemon juice, mullet bottarga (optional; see note), red pepper, thyme, rosemary, parsley"
spanish artichoke and spinach dip,Mexican,vegetarian,"spinach, onion, cream, garlic, nutmeg, salt, lime juice, artichoke hearts (cubed), polenta, refined flour, salt, water, butter, flour, salt, pepper (freshly ground)"
spanish fish fry,Mexican,nonvegetarian,"Sol fish, tomato, onion, lemon juice, olive oil, ginger and garlic paste, bay leaves, cinnamon stick, green chillies, vinegar, salt, water"
spiced almond banana jaggery cake,Dessert,vegetarian,"Butter, cinnamon molasses powder, nutmeg (powdered), almonds, sugar, eggs, orange peel, banana, flour, baking soda, baking powder, salt, buttermilk, powdered cinnamon"
spiced coffee,Beverage,vegetarian,"Freshly ground coffee, cardamom powder, ginger, milk, sugar, cream, chocolate"
spiced orange valencia cake,Dessert,vegetarian,"egg whites, egg white powder, sugar, almond powder, hazelnut powder, sugar, hazelnut (toasted)"
spicy chicken curry,Indian,nonvegetarian,"oil, ghee, onion paste, garlic paste, ginger paste, turmeric powder, salt, tomato puree, coriander powder, red chilli powder, cumin powder, garam masala, chicken leg pieces, coriander leaves, water"
spicy chicken masala,Indian,nonvegetarian,"mustard oil, curry leaves, kalonjee, saunf, garlic, onion, tomatoes, ginger, green chillies, boneless chicken, salt, tomato puree, red chilli powder, cumin powder, black salt, peppercorn (crushed), water, mint, coriander"
spicy creamy kadai chicken,Indian,nonvegetarian,"chicken, ginger-garlic paste, pepper powder, lime juice, oil, salt, tomatoes, green chillies, ginger-garlic paste, chilli powder, black cardamoms, cloves, water, onion, ginger, green chillies, chilli powder, turmeric powder, garam masala, kasturi methi, cream"
spicy watermelon soup,Healthy Food,vegetarian,"Watermelon, ginger-garlic paste, peppermint, chili flakes, olive oil (to cook)"
spinach & banana pancakes,Healthy Food,vegetarian,"Rolled Oats, Milk, Spinach, Banana, Egg, Cinnamon Powder, Vanilla Extract, Baking Powder"
spinach and feta crepes,French,vegetarian,"milk (whole fat or skimmed), flour, water, butter, honey, salt, vegetable oil, extra butter (for crisping the crepe), spinach, feta cheese (crumbled), greek yogurt (whisked), honey"
steam bunny chicken bao,Japanese,nonvegetarian,"buns, all purpose white flour, dry yeast, sugar, salt, warm water, chicken mince, eggs, soy sauce, sugar, sesame oil, worcestershire sauce, chives, aromat powder"
steam bunny chicken bao ,Japanese,nonvegetarian,"Buns, Flour, Dry Yeast, Sugar, Salt, Hot Water, Chicken Mince, Eggs, Soy Sauce, Sugar, Sesame Oil, Worcestershire Sauce, Chives, Aromat Powder"
steamed chicken roulade,French,nonvegetarian,"lamb mince, garlic , salt, paprika powder, pomodaro tomatoes, olive oil, celery, shallots, carrot, black pepper, bay leaf, yellow chilli powder, cilantro, chicken thigh, salt, white pepper powder, garlic paste, white wine vinegar, olive oil, yellow chilli powder, refined oil, fenugreek seeds, white pepper powder, garlic, fenugreek leaves, onion, broken cashew, salt, fresh cream, kasoori methi"
sticky rum chicken wings,Snack,nonvegetarian,"chicken wings without skin, hung curd, chilli powder, sweet paprika powder, english mustard paste, garlic paste, salt, garlic, rum, bbq sauce"
strawberry & pistachio breton tart,Dessert,vegetarian,"plain flour, baking powder, sea salt, unsalted butter, egg yoks, castor sugar, double cream, yolk, sugar, gelatine, butter, pistachio paste, strawberry"
strawberry quinoa pancakes,Healthy Food,vegetarian,"quinoa, milk, olive oil, egg (slightly beaten), baking powder, orange essence, castor sugar, maple syrup, strawberries (to garnish)"
sugar free modak,Japanese,vegetarian,"seedless dates, almonds, cashew nuts, walnuts, raisins, dry coconut, poppy seeds, ghee"
summer squash salad,Healthy Food,vegetarian,"white balsamic vinegar, lemon juice, lemon rind, red chillies, garlic cloves (crushed), olive oil, summer squash (zucchini), sea salt, black pepper, basil leaves"
sunga pork,Japanese,vegetarian,curry
surmai curry with lobster butter rice,Thai,vegetarian,"tamarind, red chilli powder, turmeric powder, salt, fresh coconut, onion, garlic cloves, coriander seeds, fenugreek seeds, red chilli powder, turmeric powder, tamarind (lemon sized), butter, lobster (de-shell and devein and make a small cube), salt and lime, surmai"
sweet chilli almonds,Snack,vegetarian,"almonds whole, egg white, curry leaves, salt, sugar (fine grain), red chilli powder"
sweet potato and quinoa bowl,Healthy Food,vegetarian,"Sweet Potato Cubes, Coconut, Onion, Knoia (Ripe), Raisins, Cashew, Pepper Powder, Caen, Cassia, Salt"
sweet potato pie,Dessert,vegetarian,"yams (red skinned), condensed milk, sugar, egg , cinnamon , marshmallows ,"
tandoori chicken,Indian,nonvegetarian,as a dish originated in the punjab before the independence of india and pakistan.
tandoori fish tikka,Indian,nonvegetarian,chickenn lime and ginger and cooked over an open fire.
thai fish curry,Thai,nonvegetarian,"fish (cubed), thai green curry paste, oil, onions, garlic, ginger/galangal, coconut milk, coriander, lemon juice, palm sugar, basil leaves, salt & pepper"
thai lamb balls,Thai,nonvegetarian,"lamb (minced), couscous, scallion, garlic, egg, parsley, olive oil, mint, ao nori herb, salt, five spice, cinnamon powder"
thai pineapple rice,Thai,vegetarian,"rice, onion, thai ginger , fresh turmeric, curry leaf, lemon grass, coconut milk, salt, hot curry powder, pineapple chunks, oil, water, turmeric powder, fresh pineapple"
thai prawn curry & baked rice ,Thai,vegetarian,"jeera whole, coriander seeds, kashmiri chilly, garlic, ginger, green chillies, kokum, coconut, onion, tomatoes, coriander, prawns, salt, turmeric powder, garlic paste, asafoetida, refined oil, ginger paste, goan rice, coconut milk, green chillies, fresh coconut, hing, refined oil, coriander leaves, basmati rice, coconut milk, green chillies, coconut milk, coconut, salt, green chillies, curry leaf, lecite"
thai style chicken tikka,Thai,nonvegetarian,"Chicken Thais, Thai Ginger, Lemon Leaves, Lemongrass, Coconut Milk Powder, Refined Oil, Red Curry Paste, Peanut Butter, Bezel Leaves, Lotus Stem, Yellow Butter, Chaat Masala"
tricolour pizza,Italian,vegetarian,"pizza base , pizza sauce, mozzarella cheese, black olive, green capsicum, carrots, olive oil"
tricolour salad,Healthy Food,vegetarian,"vinegar, honey/sugar, soy sauce, salt, garlic cloves (minced), chilli pepper (sliced), green papaya, carrot (peeled), cucumbers, mint leaves, toasted peanuts"
veg fried rice,Chinese,vegetarian,"oil, ginger-garlic paste, spring onion, carrot, cabbage, capsicum, salt, soy sauce, vinegar, rice"
veg hakka noodles,Chinese,vegetarian,"noodles, salt, oil, garlic paste, ginger paste, beans, cabbage, carrot, spring onion, capsicum, soy sauce, green chilli sauce, tomato sauce"
veg summer rolls,Thai,vegetarian,"rice paper sheets, iceberg lettuce, carrot, bean sprouts, cucumber, tofu, basil, mint leaves, coriander, rice noodles (soaked in warm water for 20-25 minutes), peanuts, hoisin sauce, peanuts, garlic, oil, red chillies, water"
vegetable biryani,Indian,vegetarian,"Cumin, Onion, Ginger Garlic, Mix Vegetable, Coriander Powder, Garam Masala, Turmeric Powder, Salt, Red Chilli Powder, Green Chillies, Lemon Juice, Steamed Rice, Green Coriander"
vegetable bruschetta,Italian,vegetarian,"baguette (grilled slices), black olive tapenade, artichoke hearts, lettuce arugula (trummed), tomato confit, fresh basil leaves, mint leaves, zucchini, goat cheese, parmesan cheese shavings, mozzarella buffalo cheese"
vegetable manchurian,Chinese,vegetarian,"mixed vegetables - chopped fine or grated, eggs (slightly beaten), refined flour, garlic paste, ginger paste, water, oil , garlic , onions , capsicum, cornflour (blended with water), vinegar, salt, soya sauce, tomato puree, celery, ajinomoto (optional), water"
