name,course,diet,ingredients
caramelized sesame smoked almonds,Snack,vegetarian,"red lentils or masoor dal (half-boiled), potato (grated), carrot, french beans, bread slices, ground chickpea flour (sattu), green chillies, ginger, onions, garlic (minced), salt, sugar, chaat masala, red chilli powder, garam masala, corn flour, besan, bread crumbs for crunchyness, coriander, refined oil (for fryingp)"
carrot ginger soup,Healthy Food,vegetarian,"Carrots, Olive Oil, Salt, Vegetable Stock, Ginger, Thyme, Onion, Garlic Buds, Pepper (Freshly Picked)"
cashew nut cookies,Dessert,vegetarian,"cashew paste, ghee, khaand (a sweetening agent and a healthier substitute of sugar), flax or chia seeds, plain yogurt, baking soda, baking powder, vanilla, oats, organic all-purpose flour"
cauliflower and chicken biryani,Indian,nonvegetarian,"boneless chicken, biryani masala, yogurt, onions, coconut oil, cauliflower, coconut (diced), onion (diced), peppercorns, cardamoms, cumin seeds, bay leaves, cinnamon, cloves, coconut oil, garam masala, dry chilli flakes, turmeric powder, black peppercorns, cardamom, cinnamon, garlic (crushed), tomato puree, green chillies, fresh ginger (peeled), dry red chilli, salt"
cheese and avocado parantha,Mexican,vegetarian,"Wheat flour, Kasuri methi, water, olive oil, avocado, mozzarella cheese, pizza tasting, ghee, salt"
cheese and ham roll,Snack,vegetarian,"hung curd, butter, cream, ground pimento, lemon juice, vodka, salt and pepper, asparagus spears(cooked), ham, pineapple slices"
cheese chicken kebabs,Indian,nonvegetarian,"Chicken Thais, Garlic Paste, Garlic Paste, Yellow Chilli Powder, Cheese, Curd, Gram Flour, Green Cardamom Powder, Yellow Chilli Powder, Mace Powder, Nutmeg Powder, Rock Salt, Green Coriander, Oil"
chettinad fish fry,Indian,nonvegetarian,"Surmai fish, oil, garlic buds, ginger (mash), cumin, fennel, whole coriander, black pepper, mustard seeds, curry leaves, salt, oil, water, tomatoes, red pepper powder, turmeric powder, tamarind pulp, cornflour, lemon pieces of"
chettinadu chicken,Indian,nonvegetarian,chicken and spices
chicken 65,Chinese,nonvegetarian,"ed chicken preparation. chicken, onion, ginger"
chicken and mushroom lasagna,Italian,nonvegetarian,"chicken, salt, crush black pepper, garlic cloves (minced), olive oil, fresh thyme, button mushroom, onion, low fat milk, basil, basil-tomato sauce"
chicken biryani,Indian,nonvegetarian,"malabar peppercorn, cinnamon stick, green cardamom pods, star anise, cloves, fennel seeds, vermicelli, desi ghee, shahi jeera, bay leaves, green chilli, mint leaves, onion, saffron, garlic paste, salt, chicken (dark meat), ginger paste, turmeric powder, coriander powder, red chilli powder, roma tomatoes (de-seedeed), water"
chicken dong style,Chinese,nonvegetarian,"Oil, chicken breast, garlic, ginger, tomato catchup, oyster sauce, shitake mushrooms, bomb shoots (boiled), salt, sugar, broth powder, shocking wine, potato starch, sesame oil, green onions"
chicken dragon,Chinese,nonvegetarian,"Chicken (boneless and cut into small pieces), eggs (lightly whipped), maida, garlic paste, ginger paste, salt, water, oil"
chicken farcha,Indian,nonvegetarian,"boneless chicken thigh (without skin), lemon juice, garlic paste, ginger paste, red chilli powder, coriander powder, garam masala, black pepper (crushed), salt, bread crumbs / semolina, eggs, red chilli powder, oil"
chicken gilafi kebab,Indian,nonvegetarian,"Chicken Mince, Onion, Tomato, Green Capsicum, Green Coriander, Green Chilli, Salt, Oil, Cashew, Almond, Mint, Red Chilli Powder, Ginger Garlic Paste, Cumin Powder, Lemon Juice, Fresh Cream, Kewda Water"
chicken in mahalak sauce,Indian,nonvegetarian,"Salt, sugar, seasonings, oil, corn flour, chicken leg, fresh chilli, garlic, ginger, onion, red chili paste, tomato catchup, paprika, yellow capsicum, vegetable stock"
chicken in white wine,Italian,nonvegetarian,"black pepper, plain flour, olive or sunflower oil, rashers lean bacon, onions or shallots (cut in half), mushrooms, butter, boneless and skinless chicken breasts (chopped into 3cm pieces), dry white wine, chicken or vegetable stock, garlic cloves, bay leaves, fresh thyme sprigs (washed or 1/2 tsp dried thyme)"
chicken masala,Indian,nonvegetarian,"Chicken, ginger, garlic, onion, tomato, garam masala, bay leaves, salt, turmeric, coriander powder, red chilli powder, oil, green coriander, cream"
chicken minced salad,Healthy Food,nonvegetarian,"olive oil, chicken mince, garlic (minced), onion, salt, black pepper, carrot, cabbage, green onions, sweet chilli sauce, peanut butter, ginger, soy sauce, fresh cilantro, red pepper flakes (crushed), tarts"
chicken nimbu dhaniya shorba,Beverage,nonvegetarian,"water, chicken (diced)), ginger garlic paste, coriander, lemon, cream, butter, turmeric powder, green chilli paste, cornflour, salt"
chicken paella,Mexican,nonvegetarian,"chicken, oil, salt and pepper, paprika powder, chilli flakes, garlic paste, onions, bell peppers, rice, vegetable stock, saffron, peas, olives, parsley, white wine"
chicken palwal,Indian,nonvegetarian,"Chicken, Onion, Tomato, Green Chilli, Cumin Powder, Coriander Powder, Green Coriander, Curd, Ginger Garlic, Red Chilli Powder, Salt, Oil"
chicken parmigiana with tomato sauce,Italian,nonvegetarian,"for chicken parmigiana:, chicken breast, egg whole frozen, flour, planko bread crumbs, fresh italian parsley, vegetable oil, solid butter unsalted, tomato sauce, mozzarella cheese, italian parmesan cheese, thyme, for pepperonata:, red pepper, green pepper, yellow pepper, red onion, fresh tomato, butternut squash, garlic, pure olive oil, vegetable oil, black pepper corn (crushed), salt, parsley, for garnishing:, parsley sprig, spinach"
chicken popcorn,Chinese,nonvegetarian,"chicken (boneless), corn flour or all purpose flour, egg, bread crumbs, salt, ginger garlic paste, black pepper, onion powder (optional), red chilli powder or paprika or cayenne pepper, oil for deep frying"
chicken potli,Chinese,nonvegetarian,"chicken, onion, green chilli, garlic, ginger, salt, aromatic powder, soya sauce, oyster sauce, spring onion, filo sheets"
chicken quinoa biryani,Healthy Food,nonvegetarian,"onions, tomato, green chillies(slit open), ginger garlic paste, mint leaves, coriander leaves/cilantro, fresh yogurt/curd(beaten), turmeric powder, chilli powder, salt, chicken (cut into pieces), garam masala powder, ginger garlic paste, yogurt/curd, chilli powder, coriander powder, salt, oil, cloves, bay leaf , cardamom"
chicken razala,Indian,nonvegetarian,chicken cooked in a rich gravy with mint
chicken roulade,French,nonvegetarian,"chicken breasts, olives, jalapenos, bell peppers(all 3), thyme dried, white wine, salt, black pepper (crushed to taste), egg, olive oil, mozerella cheese, processed cheese"
chicken shaami kebab,Indian,nonvegetarian,"Chana Dal, Chicken Thai, Salt, Whole Red Chillies, Cumin, Whole Coriander, Cloves, Pepper Whole, Cinnamon Stick, Celery, Eggs, Green Coriander, Mint, Green Chillies, Ginger, Garlic Buds, Oil"
chicken shami kebab,Indian,nonvegetarian,"oil, cumin seeds, cloves, black peppercorns, cinnamon, coriander seeds, ajwain, red chilli whole, chilli flakes, boneless chicken, salt, water, ginger, green chilli, garlic, coriander leaves , mint leaves , egg"
chicken sukka,Indian,nonvegetarian,"chicken (small pieces), onion (thin slices), cardamom, salt, oil, coriander, cumin, mustard, pepper, cloves, cinnamon, bedki chillies, kashmiri chilies, turmeric, onion, garlic, ginger, salt"
chicken tenders,Snack,nonvegetarian,"chicken breast (cut into strips), salt, garlic paste, ginger paste, green chilli paste, oats, refined flour, salt, freshly ground black pepper, fried mixed herbs (italian herb), garlic powder"
chicken tikka,Indian,nonvegetarian, served on a skewer
chicken tikka masala,Indian,nonvegetarian,chicken roasted in a yogurt tomato sauce. creamy texture.
chilli chicken,Chinese,nonvegetarian,"boneless chicken, salt, cornflour, black pepper, egg, soy sauce, red chilli sauce, garlic, green chillies, green chilli sauce, vinegar, onion, capsicum, black pepper, salt"
chilli fish,Chinese,nonvegetarian,"For fish pieces (Boneless), Flour, Cornflour, Baking Powder, Soy Sauce, Celery, Pepper, Salt, Oil, Green Onion, Sauce:, Ginger, Garlic, Green Chili, Soy Sauce, Tomato Sauce, Chili Sauce, Cornflour"
chocolate and almond rum ball ,Dessert,vegetarian,"Chocolate sponge eggless, dark chocolate, single cream, almonds, castor sugar, instant coffee powder, dark rum"
chocolate appe,Snack,vegetarian,"rice, coconut, baking powder, vanilla extract, cinnamon powder, brown sugar, unsweetened cocoa powder, salt, chocolate chips, butter"
chocolate chip cheesecake,Dessert,vegetarian,"butter biscuits (broken into pieces), butter (softened), cream cheese (softened), sugar, egg, rose essence or vanilla essence, chocolate chips"
chocolate doughnut,Dessert,vegetarian,"Sugar, egg yolks, egg, butter, yeast, milk"
chocolate fudge cookies,Dessert,vegetarian,"dark chocolate coverture, butter, sugar, eggs, flour, baking powder, salt, cocoa powder, vanilla essence"
chocolate kaju katli,Dessert,vegetarian,"cashew nuts, sugar, water, milk chocolate or dark chocolate"
chocolate lava cake,Dessert,vegetarian,"dark chocolate, butter, icing sugar, egg yolks + whole eggs, flour"
chocolate marquise,Dessert,vegetarian,"dark chocolate (melted), castor sugar, egg yolk, egg, cocoa powder, coffee, cream, berries, dark chocolate, fresh cream"
chocolate nero cookies,Dessert,vegetarian,"almonds, eggs, granulated sugar, bittersweet chocolate, unsalted butter, flour, baking powder, castor sugar, icing sugar"
chocolate prunes gujiyas,Japanese,vegetarian,"for gujiya pastry:, refined flour, ghee, water, salt, for gujiya stuffing:, dark chocolate, prunes, mawa, sugar, cardamom"
chocolate samosa,Snack,vegetarian,"refined flour, desi ghee, black cardamom seeds, chocolate block, almonds, cashew nuts, pistachio, sugar, garam masala powder, oil"
christmas cake,Dessert,vegetarian,"christmas dry fruits (pre-soaked), orange zest, lemon zest, jaggery syrup, almond flour, apple, butter (softened), eggs"
christmas chocolate fudge cookies,Dessert,vegetarian,"unsalted butter, brown sugar, chocolate, chocolate chips, eggs, flour, cocoa powder, baking powder"
christmas dry fruit cake,Dessert,vegetarian,"butter (at room temperature), dark brown sugar, eggs, flour, salt, all spice powder, cinnamon, nutmeg, currants; golden raisins; dark raisins (each), soft dried figs, dates (pitted), prunes (stoned dried), apricots (dried), almonds (chopped), brandy, instant espresso (mixed with 1 tbsp water)"
christmas tree pizza,Italian,vegetarian,"pizza dough (2 boules), red pepper, red onion, basil pesto (purchased, homemade or vegan pesto), mozzarella cheese, kosher salt"
cinnamon oatmeal pancakes,Healthy Food,vegetarian,"rolled oats, buttermilk (divided), whole wheat flour or oat flour, baking powder, baking soda, cinnamon, salt, eggs, canola oil , honey or maple syrup,"
cinnamon star cookies,Dessert,vegetarian,"Butter, Castor Sugar, Christmas Mix Spicy, Cinnamon Powder, Honey, Glucose, Cream, Poultry Flour, Baking Soda, Bread Flour"
clotted cottage cheese croquettes,Italian,vegetarian,"black pepper, black salt, bread crumb, corn flour, refined oil, jalapeno, jeera powder, maida, cottage cheese, parsley, salt, for thousand island dressing:, mayonnaise, tomato ketchup, minced garlic, celery, black pepper"
coconut lime quinoa salad,Healthy Food,vegetarian,"uncooked quinoa, water, red onion, cucumber (diced), purple cabbage, avocado (ripened and diced), orange, shelled edamame (defrosted), unsweetened toasted coconut flakes, almonds, few shakes of black pepper, for the dressing:, orange juice, lime (juiced), apple cider vinegar, olive oil"
coconut mango oatmeal with cinnamon hint,Healthy Food,vegetarian,"coconut (tender), coconut milk, oats, ripe mango (diced), castor sugar, dry fruits, honey, cardamom powder"
coffee marinated mutton chops,Thai,nonvegetarian,"mutton chops, espresso, honey, balsamic vinegar, rosemary, pink peppercorns (crushed), olive oil, salt"
corn & jalapeno poppers,Mexican,vegetarian,"fresh corn kernels, corn flour, whole egg, cheddar cheese, jalapeno poppers, smoked paprika, coriander (toasted & ground), green onions, fresh cilantro, lemon (zest and juice), cooking oil"
corn and raw mango salad,Healthy Food,vegetarian,"Corn kernels, onions, green onions, paprika, raw mango (pieces), celery stock (pieces), cherry tomatoes, pineapple (pieces), pasarley, green coriander, badge leaves, black olive, lemon juice, olive Oil, black salt, white pepper powder, taco shell"
corn pulao,Indian,vegetarian,"basmati rice, american corn kernels, olive oil, onion, ginger garlic paste, salt, green chillies, cumin seed, bay leaf, pepper corn, cloves, hot water, coriander leaves, lime juice, bell pepper (saut?ed and diced), coconut"
couscous with ratatouille - tangy tomato sauce,French,vegetarian,"for the cous cous:, plain couscous, extra virgin olive oil, vegetable stock, herbs (basil, parsley, thyme, cilantro work best), for the ratatouille:, olive oil (regular not extra virgin), red onions, aubergines (cut in to 3 cm cubes), zucchini (cut in to 3 cm cubes), garlic cloves, ground cumin, sweet paprika, tomato paste, salt"
cream of almond soup,Healthy Food,vegetarian,"vegetable stock, skimmed milk, toasted almonds (powdered), butter, flour, salt and pepper, nutmeg, almond essence, toasted almond flakes"
crispy herb chicken,Italian,nonvegetarian,"fresh breadcrumbs, parmesan cheese, lemon rind, fresh parsley leaves, garlic powder, plain flour, egg, milk, chicken breast supremes, vegetable oil, mayonnaise, sour cream, fresh chives (dried if fresh not available), fresh parsley (dried if fresh not available), garlic, red onion (optional), ground black pepper, salt"
crunchy vegetable dal sattu croquettes,Italian,vegetarian,"red lentils or masoor dal (half-boiled), potato (grated), carrot, french beans, bread slices, ground chickpea flour (sattu), green chillies, ginger, onions, garlic (minced), salt, sugar, chaat masala, red chilli powder, garam masala, corn flour, besan, bread crumbs for crunchyness, coriander, refined oil (for fryingp)"
curd rice,Indian,vegetarian,"rice, water, curd, milk, carrot, green chilli, ginger, salt, coriander leaves, oil, mustard seeds, chana dal, urad dal, curry leaves, red chilli, hing"
curry fish fingers,Thai,nonvegetarian,"river sole fish (cut in thin strips), garlic paste, salt , lime juice, beer, flour, cornflour, white pepper, eggs, mustard"
dahi chicken,Indian,nonvegetarian,"dahi, cumin powder, garlic paste, garam masala, turmeric powder, red chilli powder, salt, boneless chicken, oil, green chilli, onion, tomato"
dahi lasooni chicken,Indian,nonvegetarian,"chicken (boneless, cube size), chesse, garlic, ginger garlic paste, coriander, green chilli paste, cream (fresh), curd, kaju paste, salt, black salt , garam masala, chaat masala, butter"
damdama fish curry,Indian,nonvegetarian,"Fish, onion, tomato, reshagi red chilli powder, cumin powder, coriander powder, coriander, cumin, salt, oil"
dark night,Beverage,vegetarian,"whisky, honey, cinnamon, star anise, cloves, green apple"
dates and nuts ladoo,Dessert,vegetarian,"dates (pitted), mixed nuts (almonds, cashews, walnuts, pistachios, peanuts), dessicated coconut (optional)"
detox haldi tea,Beverage,vegetarian,"haldi, ginger, black pepper, honey, water"
deviled scotch egg,French,nonvegetarian,"Lamb Keema, Rosemary, Thyme, Eggs (hard boiled peel), Flour, Eggs (Lightly Whipped), Panco, Peanut Oil, Salt, Pepper, Mayonnaise, Apple Cedar Vinegar, English Mustard, Salt, Pepper, Paprika and Olive Powder"
double chocolate easter cookies,Dessert,vegetarian,"Butter, Brown Sugar, Castor Sugar, Vanilla Essence, Dark Chocolate, Refined Flour, Cocoa Powder, Baking Soda, Salt, Milk, Cadbury Gems"
double chocolate easter cookies ,Dessert,vegetarian,"Butter, Brown Sugar, Castor Sugar, Vanilla Essence, Dark Chocolate, Refined Flour, Cocoa Powder, Baking Soda, Salt, Milk, Cadbury Gems"
duo of chocolate and strawberry,Dessert,vegetarian,"dark chocolate, white chocolate, strawberries"
easy bread poha,Indian,vegetarian,"oil, hing, mustard seeds, curry leaves, whole red chillies, cookes peas, peanuts, turmeric powder, salt, bread, green chillies, lemon juice, coriander leaves, dessicated coconut"
egg and cheddar cheese sandwich,Mexican,nonvegetarian,"egg, salt, pepper, ham slices, basil leaves"
egg and garlic fried rice,Chinese,nonvegetarian,"oil, garlic, spring onion , ginger, red chilli , egg, cooked rice, salt, black pepper powder, soya sauce"
egg in a blanket,French,nonvegetarian,"eggs, brown bread slices, butter, chilli flakes, oregano, salt"
egg paratha,Indian,nonvegetarian,"whole wheat flour, salt, oil, eggs, onions, green chilli, coriander leaves, garam masala"
eggless coffee cupcakes,Dessert,vegetarian,"maida/ flour, baking powder, sugar, cocoa powder, vanilla essence, butter (softened, salted. in case you are using unsalted butter, add 1/4 tsp salt), milk (to make the batter smooth. adjust the milk quantity according to your batter's smoothness), coffee powder + 1 tsp water, to make a paste (you can increase or decrease according to your coffee tolerance)"
eggless vanilla cake,Dessert,vegetarian,"maida, baking powder, castor sugar, butter, milk, vanilla essence, vinegar"
fennel scented sweet banana fritters,Dessert,vegetarian,"Wheat flour, banana, jaggery, milk or water, ghee or oil"
filo pizza,Italian,vegetarian,"filo pastry, himalayan salt, black pepper, salted butter, tomato sauce, broccoli, button mushroom, green zucchini, yellow zucchini, capsicum yellow, capsicum green, capsicum red, pizza spice mix, mozzarella cheese"
filter coffee,Beverage,vegetarian,"Coffee powder, water, milk, sugar"
fish ambultiyal,Indian,nonvegetarian,"Tuna, onion, fenugreek, whole chilli, pandan leaf, salt, water, cardamom, cinnamon, coriander powder, black pepper, red chilli, curry powder, garlic (crushed), chili flakes, gorca, salt"
fish andlouse,French,nonvegetarian,"white wine and water mix to cover, onion, salt, bay leaf, black pepper corns, olive oil, onion, garlic, tomatoes (peeled and seeded), basil leaves, spring fresh thyme - optional 1 bay leaf, salt and pepper, olive oil, wine vinegar, prepared mustard, salt and pepper, assorted garden herbs ( parsley, basil etc."
fish curry,Thai,nonvegetarian,"fresh sole fish, black pepper powder, lemon (juiced), onion, coriander seeds, black pepper, raw rice, garlic cloves, coconut, coriander leaves, ginger (large), cinnamon powder, clove powder, ground nut oil, tamarind paste, cooking oil, salt,"
fish moilee,Indian,nonvegetarian,"Basa fish, onion, ginger, garlic buds, green chillies, turmeric, red chilli powder, coriander powder, lemon juice, curry leaves, refined oil, refined oil, mustard seeds, black pepper, fennel, green cardamom, coconut milk, Cherry tomatoes"
fish salan,Mexican,nonvegetarian,"King fish, ripe tomatoes, desi ghee, ginger-garlic paste, onion, turmeric powder, red chilli powder, black pepper powder, garam masala, ginger, turmeric powder, fennel powder, refined oil, salt, water"
fish skewers with coriander and red wine vinegar dressing,Thai,nonvegetarian,"sea bass fillets, olive oil (for grilling), red wine vinegar, sugar, extra virgin olive oil, garlic clove, coriander, bamboo skewers"
fish with jamun sauce,Indian,nonvegetarian,"jamun, sugar, chilli, garlic cloves (minced), cumin (powdered), fish fillet (pomfret (or any white fish), semolina, salt, wilted spinach"
fish with white sauce,Italian,nonvegetarian,"Fillet fish, oil, milk, flour, butter, salt, ground black pepper"
flattened rice / poha,Indian,vegetarian,"dehusked rice which is flattened into flat light dry flakes, these flakes of rice swell when added to liquid, whether hot or cold, as they absorb water, milk, or any other liquids. the thicknesses of these flakes vary between almost translucently thin (the more expensive varieties) to nearly four times thicker than a normal rice grain."
flax seed and beetroot modak,Japanese,vegetarian,"rice flour, salt, oil (for greasing), beetroot puree, tossed flax seeds (for topping), fresh coconut, jaggery, poppy seeds, green cardamom powder, nutmeg powder"
french onion grilled cheese,French,vegetarian,"Brown slice bread, onion, oil, emmental cheese"
french pork chop,French,vegetarian,"pork chop, pink pepper corn, green pepper corn, aromatic sauce, salt, black pepper, salted butter, refined oil, red cabbage, bell pepper chop, apricot, onion, red wine, ancho chilli, cayenne pepper, microgreen"
fried rice with soya chunks,Chinese,vegetarian,"basmati rice, carrot, capsicum, beans, green peas, ginger, garlic, green chillies, bay leaf, cinnamon sticks, green cardamoms, clove, soya chunks, salt,"
fruit cube salad,Healthy Food,vegetarian,"watermelon, cantaloupe, kiwifruiit, pineapple, marshmallow, mint leaf (crushed nuts, sesame seeds or cinnamon)"
fruit infused tea,Beverage,vegetarian,"chamomile tea bags, orange, berries, blueberries, ginger, mint leaves, boiling water"
gajar tart,French,vegetarian,"white butter, breakfast sugar, milk full fat, refined flour, winter carrots, ghee, sugar, khoya, cardamom powder, cashew nuts (crushed), almonds (crushed), full fat milk, full fat milk, grain sugar, green cardamom powder"
garlic and pinenut soup with burnt butter essence,French,vegetarian,"garlic cloves, almonds (whole), parsley, bayleaf, chicken broth, nutmeg, egg yolk, heavy cream, white bread slices, butter, salt, pepper, white wine"
garlic soya chicken,Healthy Food,nonvegetarian,"chicken thigh/breast (cut crosswise into 1/2-inch-thin strips), sesame oil (toasted), white pepper (finely ground), ginger juice, peanut oil or vegetable oil (divided), garlic cloves (minced), ginger, red chilli flakes, red onion , snow peas (trimmed), red bell pepper (cut into thin strips), rice vinegar, soy sauce, dark soy sauce, chinese rice wine, brown sugar, cornflour"
ghee roast chicken dosa quesadilla,Mexican,nonvegetarian,"dry red chillies, coriander seeds, cumin seeds, fenugreek seeds, black pepper, clove, garlic, turmeric powder, boneless chicken, curd, lemon (juiced), for cooking chicken:, tamarind pulp, ginger (1 inch), garlic cloves, onion, tomato, ghee, red chilli powder, salt, crushed jaggery, dosa batter (for 4 dosas), processed cheese, ghee or oil (to crisp the dosa), coriander leaves, curry leaves (deep fried), curd, salt, zeera powder, sugar, red chilli powder"
gluten free almond cake,Healthy Food,vegetarian,"Almond Powder, Egg, Honey, Baking Soda, Vanilla Essence, Salt, Honey, Almond"
green asparagus risotto,Italian,vegetarian,"carnaroli rice, vegetable broth, butter, extra virgin olive oil, parmigiano cheese, onion (minced), white wine, salt & pepper"
green cucumber shots,Healthy Food,vegetarian,"english cucumbers, garlic cloves (smashed), romaine lettuce, basil, parsley, cilantro, big lemon, sea salt, olive oil"
green lentil dessert fudge,Dessert,vegetarian,"whole moong beans, cow ghee, raisins, whole milk, jaggery (organic), ground cardamom, almonds (halved)"
grilled almond barfi,Dessert,vegetarian,"khoya, sweetener (optional), almonds (crushed)"
grilled kasundi honey chicken with sweet potato mash,Indian,nonvegetarian,"Chicken breast, kasundi (Bengali mustard sauce), sweet potato, red and yellow capsicum, broccoli, garlic buds, refined oil, salt, butter, cream, green onion, honey, ginger and garlic paste"
grilled lemon margarita,Beverage,vegetarian,"vanilla infused tequila, vanilla liqueur, lemon juice, lemon, lemon"
half roast chicken,Healthy Food,nonvegetarian,"cooking oil, whole chicken (skin on- rinsed and dressed), onions (quartered- skin on), garlic (halved - skin on), carrots (roughly quartered), celery , thyme, dunkleweizen (pour into a glass and keep open at room temperature for an hour or two to make flat), chicken stock, butter, sea salt"
hassel back sweet potatoes,Healthy Food,vegetarian,"sweet potatoes, butter, brown sugar, pure vanilla extract, ground cinnamon, himalayan pink salt / rock salt"
hawaiin papaya salad,Healthy Food,vegetarian,"papaya, fresh lime (juiced), watermelon balls or small squares (seedless), fresh pineapple chunks, coconut (unsweetened), vanilla flavoured yogurt (low fat)"
holi special bhang pakode,Indian,vegetarian,"besan, potato, fresh bhang leaves, spinach, bhang seed powder, ajwain, fresh green chilly , salt, tamarind paste, red chilly powder, mustard seeds, whole red chilli, soda"
holi special ice tea thandai,Beverage,vegetarian,"ground white pepper (kali mirch), assam tea bags, almonds (badam) - coarsley crushed, poppy seeds (khus-khus), fennel seeds (saunf) (crushed coarsely), cardamom (elaichi) powder, ground sugar, saffron (kesar) strands"
holi special malai kofta,Indian,vegetarian,"potatoes, paneer (cottage cheese), maida, coriander leaves (chopped), onion, ginger-garlic paste, tomatoes, malai or cream, raisins and cashew nuts, cashew nuts paste, haldi, red chilli powder, kitchen king masala, kasuri methi (dry fenugreek), salt, sugar"
homemade gulab jamun,Dessert,vegetarian,"sugar, water, milk, cardamom seeds, saffron, cardamom powder, khoya, baking soda, maida, milk"
hot chocolate,Beverage,vegetarian,"milk, chocolate, cocoa powder, powdered sugar, cinnamon, vanilla"
instant rava dosa,Indian,vegetarian,"rava/suji/semolina, rice flour, all purpose flour, fresh coconut (pieces), jeera, green chilli, dhaniya, onion (diced), salt, water, oil, ghee/clarified butter"
jalapeno cheese fingers,Mexican,vegetarian,"yellow cornmeal, sugar, baking soda, salt, buttermilk (well-shaken), egg, cheddar (extra sharp), scallion (white and pale green parts only), pickled jalapenos (drained), unsalted butter,"
jalebi with fennel yogurt pudding,Dessert,vegetarian,"all purpose flour, yogurt, oil, sugar, water, saffron, green cardamom, yogurt (strained), milk (warm), sugar, nutmeg, cardamom powder"
